{
  "anonymous_arm_id": "ARM-A",
  "attempt_id": "EXP-CASE-004-ARM-A-R2-A01",
  "attribution_basis": "RUNNER_POLICY_TERMINAL",
  "case_id": "CASE-004",
  "classification_hash": "bf2089995728681bbdeb488f9815e8e8ff7e16f33d2d61b5c66ab4c98f3a3556",
  "classification_id": "CLASSIFICATION:EXP-CASE-004-ARM-A-R2-A01",
  "confidence": "HIGH",
  "evidence_refs": [
    "evals/results/phase-002d/attempts/EXP-CASE-004-ARM-A-R2-A01.json",
    "evals/results/phase-002d/eligibility/EXP-CASE-004-ARM-A-R2-A01.json",
    "evals/results/phase-002d/oracle/EXP-CASE-004-ARM-A-R2-A01.json",
    "evals/results/phase-002d/process_evidence/EXP-CASE-004-ARM-A-R2-A01.json",
    "rules/dynamic_eval_rules.yaml#hard_failures.HARD-FAIL-003"
  ],
  "identity_used": false,
  "observed": {
    "completion_status": "FAILED",
    "failure_class": "POLICY_VIOLATION",
    "hard_failures": [
      "HARD-FAIL-003"
    ],
    "oracle_status": "NOT_RUN",
    "primary_eligible": false,
    "process_evidence_status": "FAIL",
    "retry_of": null,
    "schema_valid": false
  },
  "primary_classification": "TERMINAL_POLICY_FAILURE",
  "recovery_used": false,
  "repeat_id": 2,
  "schema_version": "1.0.0",
  "secondary_flags": [
    "HARD_FAIL_003_RECORDED",
    "OBSERVATION_UNAVAILABLE",
    "ORACLE_NOT_RUN",
    "POLICY_VIOLATION_RECORDED",
    "PROCESS_EVIDENCE_FAIL",
    "SCHEMA_INVALID_RECORDED"
  ],
  "slot_id": "CASE-004-ARM-A-R2"
}
